{
  "$schema": "https://json-schema.org/draft/2020-12/schema",
  "$id": "urn:oripa:site-manifest:2.0.0-alpha.1",
  "title": "Oripa Site Manifest",
  "description": "Public-safeなSite設定とCore Compatibility Familyを宣言する。",
  "type": "object",
  "additionalProperties": false,
  "required": [
    "schema_version",
    "site_version",
    "compatibility",
    "public"
  ],
  "properties": {
    "schema_version": {
      "type": "string",
      "const": "2.0.0-alpha.1"
    },
    "site_version": {
      "$ref": "#/$defs/semantic_version"
    },
    "compatibility": {
      "type": "object",
      "additionalProperties": false,
      "required": [
        "family",
        "storefront_client_version",
        "required_capabilities"
      ],
      "properties": {
        "family": {
          "type": "integer",
          "const": 2
        },
        "storefront_client_version": {
          "$ref": "#/$defs/semantic_version"
        },
        "required_capabilities": {
          "$ref": "#/$defs/capability_list"
        }
      }
    },
    "public": {
      "type": "object",
      "additionalProperties": false,
      "required": [
        "locale",
        "timezone",
        "features"
      ],
      "properties": {
        "locale": {
          "type": "string",
          "pattern": "^[A-Za-z]{2,3}(?:-[A-Za-z0-9]{2,8})*$",
          "minLength": 2,
          "maxLength": 35
        },
        "timezone": {
          "type": "string",
          "pattern": "^(?:UTC|[A-Za-z_]+(?:/[A-Za-z0-9_+.-]+)+)$",
          "minLength": 3,
          "maxLength": 64
        },
        "features": {
          "type": "object",
          "additionalProperties": false,
          "required": [
            "enabled"
          ],
          "properties": {
            "enabled": {
              "$ref": "#/$defs/capability_list",
              "default": []
            }
          }
        }
      }
    }
  },
  "$defs": {
    "semantic_version": {
      "type": "string",
      "pattern": "^(0|[1-9][0-9]*)\\.(0|[1-9][0-9]*)\\.(0|[1-9][0-9]*)(?:-((?:0|[1-9][0-9]*|[0-9]*[A-Za-z-][0-9A-Za-z-]*)(?:\\.(?:0|[1-9][0-9]*|[0-9]*[A-Za-z-][0-9A-Za-z-]*))*))?(?:\\+[0-9A-Za-z-]+(?:\\.[0-9A-Za-z-]+)*)?$"
    },
    "capability_name": {
      "type": "string",
      "pattern": "^[a-z][a-z0-9-]*\\.[a-z][a-z0-9-]*\\.v[1-9][0-9]*$",
      "maxLength": 128
    },
    "capability_list": {
      "type": "array",
      "items": {
        "$ref": "#/$defs/capability_name"
      },
      "uniqueItems": true,
      "default": []
    }
  }
}
